{
  "version": 1,
  "updated_at": "2026-09-24T00:00:00Z",
  "fields": {
    "full_name": { "value": "", "type": "text" },
    "first_name": { "value": "", "type": "text" },
    "last_name": { "value": "", "type": "text" },
    "email": { "value": "", "type": "text" },
    "phone": { "value": "", "type": "text" },
    "date_of_birth": { "value": "", "type": "date" },
    "gender": { "value": "", "type": "single_choice", "options": ["Male", "Female", "Non-binary", "Prefer not to say", "Other"] },
    "nationality": { "value": "", "type": "text" },
    "city": { "value": "", "type": "text" },
    "country": { "value": "", "type": "single_choice", "options": ["United States", "United Kingdom", "Canada", "Australia", "Germany", "France", "India", "Brazil", "Japan", "Other"] },
    "zip_postal_code": { "value": "", "type": "text" },
    "alternate_email": { "value": "", "type": "text" },
    "linkedin_url": { "value": "", "type": "text" },
    "twitter_handle": { "value": "", "type": "text" },
    "website": { "value": "", "type": "text" },
    "current_job_title": { "value": "", "type": "text" },
    "current_company": { "value": "", "type": "text" },
    "industry": { "value": "", "type": "single_choice", "options": ["Technology", "Finance", "Healthcare", "Education", "Retail", "Manufacturing", "Government", "Non-profit", "Other"] },
    "employment_status": { "value": "", "type": "single_choice", "options": ["Employed full-time", "Employed part-time", "Self-employed", "Student", "Unemployed", "Retired", "Other"] },
    "years_of_experience": { "value": "", "type": "number" },
    "highest_education": { "value": "", "type": "single_choice", "options": ["High school", "Associate's degree", "Bachelor's degree", "Master's degree", "PhD / Doctorate", "Other"] },
    "university": { "value": "", "type": "text" },
    "field_of_study": { "value": "", "type": "text" },
    "language": { "value": "", "type": "single_choice", "options": ["English", "Spanish", "French", "German", "Chinese", "Japanese", "Hindi", "Arabic", "Portuguese", "Russian", "Other"] },
    "timezone": { "value": "", "type": "text" },
    "currency": { "value": "", "type": "single_choice", "options": ["USD", "EUR", "GBP", "JPY", "CAD", "AUD", "CHF", "INR", "Other"] },
    "newsletter_opt_in": { "value": "", "type": "single_choice", "options": ["Yes", "No"] },
    "how_did_you_hear_about_us": { "value": [], "type": "multi_choice", "options": ["Colleague", "Friend", "Google search", "Social media", "Online advertisement", "Other"] },
    "satisfaction_rating": { "value": "", "type": "single_choice", "options": ["1 - Very poor", "2 - Poor", "3 - Average", "4 - Good", "5 - Excellent"] },
    "would_recommend": { "value": "", "type": "single_choice", "options": ["Yes", "No", "Maybe"] }
  },
  "matchers": [
    { "field_key": "full_name", "label_patterns": ["full name", "your name", "name"], "match_type": "substring" },
    { "field_key": "first_name", "label_patterns": ["first name", "given name"], "match_type": "substring" },
    { "field_key": "last_name", "label_patterns": ["last name", "family name", "surname"], "match_type": "substring" },
    { "field_key": "email", "label_patterns": ["email", "e-mail", "email address"], "match_type": "substring" },
    { "field_key": "phone", "label_patterns": ["phone", "mobile", "cell", "telephone"], "match_type": "substring" },
    { "field_key": "date_of_birth", "label_patterns": ["date of birth", "dob", "birth date"], "match_type": "substring" },
    { "field_key": "gender", "label_patterns": ["gender", "sex"], "match_type": "substring" },
    { "field_key": "nationality", "label_patterns": ["nationality", "citizenship"], "match_type": "substring" },
    { "field_key": "city", "label_patterns": ["city", "town"], "match_type": "substring" },
    { "field_key": "country", "label_patterns": ["country", "country of residence"], "match_type": "substring" },
    { "field_key": "zip_postal_code", "label_patterns": ["zip", "postal code", "zipcode", "postcode"], "match_type": "substring" },
    { "field_key": "alternate_email", "label_patterns": ["alternate email", "secondary email", "backup email"], "match_type": "substring" },
    { "field_key": "linkedin_url", "label_patterns": ["linkedin", "linkedin profile", "linkedin url"], "match_type": "substring" },
    { "field_key": "twitter_handle", "label_patterns": ["twitter", "twitter handle", "@twitter"], "match_type": "substring" },
    { "field_key": "website", "label_patterns": ["website", "personal website", "portfolio", "blog"], "match_type": "substring" },
    { "field_key": "current_job_title", "label_patterns": ["job title", "position", "current title", "role"], "match_type": "substring" },
    { "field_key": "current_company", "label_patterns": ["company", "employer", "current company", "organization"], "match_type": "substring" },
    { "field_key": "industry", "label_patterns": ["industry", "sector"], "match_type": "substring" },
    { "field_key": "employment_status", "label_patterns": ["employment status", "employment", "work status"], "match_type": "substring" },
    { "field_key": "years_of_experience", "label_patterns": ["years of experience", "experience", "years worked"], "match_type": "substring" },
    { "field_key": "highest_education", "label_patterns": ["education", "highest education", "degree", "academic level"], "match_type": "substring" },
    { "field_key": "university", "label_patterns": ["university", "college", "school", "institution"], "match_type": "substring" },
    { "field_key": "field_of_study", "label_patterns": ["field of study", "major", "course", "specialization"], "match_type": "substring" },
    { "field_key": "language", "label_patterns": ["language", "preferred language", "primary language"], "match_type": "substring" },
    { "field_key": "timezone", "label_patterns": ["timezone", "time zone", "your timezone"], "match_type": "substring" },
    { "field_key": "currency", "label_patterns": ["currency", "preferred currency"], "match_type": "substring" },
    { "field_key": "newsletter_opt_in", "label_patterns": ["newsletter", "subscribe", "updates", "opt in"], "match_type": "substring" },
    { "field_key": "how_did_you_hear_about_us", "label_patterns": ["how did you hear", "where did you hear", "referral source", "how did you find us"], "match_type": "substring" },
    { "field_key": "satisfaction_rating", "label_patterns": ["satisfaction", "rate your experience", "how satisfied"], "match_type": "substring" },
    { "field_key": "would_recommend", "label_patterns": ["recommend", "would you recommend", "recommendation"], "match_type": "substring" }
  ]
}
